{
  "$schema": "mechanical-governance.schema.json",
  "schemaVersion": 1,
  "ownerRoles": ["maintainer", "evidence-reviewer"],
  "authorityContracts": [
    ".agent/repository-governance.json",
    ".agent/agent-operating-system.json",
    "AGENTS.md",
    ".agent/decisions/ADR-999-architecture-freeze.md"
  ],
  "execution": {
    "runner": "scripts/verify-scaffold.mjs",
    "packageScript": "verify:scaffold",
    "mode": "read-only",
    "network": "forbidden",
    "failureMode": "collect-and-fail",
    "supportScripts": [
      "scripts/lib.mjs",
      "scripts/repository-governance.mjs",
      "scripts/agent-operating-system.mjs",
      "scripts/mechanical-governance.mjs",
      "scripts/build-test-infrastructure.mjs",
      "scripts/token-contract.mjs",
      "scripts/theme-contract.mjs",
      "scripts/accessibility-foundation.mjs",
      "scripts/react-state-foundation.mjs",
      "scripts/collection-engine.mjs",
      "scripts/overlay-foundation.mjs",
      "scripts/animation-foundation.mjs",
      "scripts/data-engine.mjs",
      "scripts/internationalization.mjs",
      "scripts/date-math.mjs",
      "scripts/virtualization-foundation.mjs",
      "scripts/drag-drop-foundation.mjs",
      "scripts/reference-baseline.mjs",
      "scripts/documentation-experience.mjs",
      "scripts/foundation-specifications.mjs"
    ]
  },
  "unitTests": {
    "script": "scripts/mechanical-governance.test.mjs",
    "packageScript": "test:mechanical-governance"
  },
  "validators": [
    {
      "id": "repository-governance",
      "script": "scripts/validate-repository-governance.mjs",
      "packageScript": "validate:governance",
      "ownerRoles": ["maintainer", "evidence-reviewer"],
      "contracts": ["GOVERNANCE.md", ".agent/repository-governance.json"]
    },
    {
      "id": "agent-operating-system",
      "script": "scripts/validate-agent-operating-system.mjs",
      "packageScript": "validate:agent-os",
      "ownerRoles": ["maintainer", "evidence-reviewer"],
      "contracts": ["AI_AGENT_OPERATING_MODEL.md", ".agent/agent-operating-system.json"]
    },
    {
      "id": "mechanical-governance",
      "script": "scripts/validate-mechanical-governance.mjs",
      "packageScript": "validate:mechanical-governance",
      "ownerRoles": ["maintainer", "evidence-reviewer"],
      "contracts": ["MECHANICAL_GOVERNANCE.md", ".agent/mechanical-governance.json"]
    },
    {
      "id": "build-test-infrastructure",
      "script": "scripts/validate-build-test-infrastructure.mjs",
      "packageScript": "validate:build-test-infrastructure",
      "ownerRoles": ["maintainer", "evidence-reviewer"],
      "contracts": ["BUILD_TEST_INFRASTRUCTURE.md", ".agent/build-test-infrastructure.json"]
    },
    {
      "id": "token-contract",
      "script": "scripts/validate-token-contract.mjs",
      "packageScript": "validate:tokens",
      "ownerRoles": ["maintainer", "domain-owner", "evidence-reviewer"],
      "contracts": [
        "TOKEN_ARCHITECTURE.md",
        "registry/tokens/foundation.json",
        "specs/foundation/tokens.md"
      ]
    },
    {
      "id": "theme-contract",
      "script": "scripts/validate-theme-contract.mjs",
      "packageScript": "validate:theme",
      "ownerRoles": ["maintainer", "domain-owner", "evidence-reviewer"],
      "contracts": [
        "THEME_POLICY.md",
        "CSS_ARCHITECTURE.md",
        "registry/themes/foundation.json",
        "specs/foundation/css-theme-runtime.md"
      ]
    },
    {
      "id": "accessibility-foundation",
      "script": "scripts/validate-accessibility-foundation.mjs",
      "packageScript": "validate:accessibility-foundation",
      "ownerRoles": ["maintainer", "domain-owner", "evidence-reviewer"],
      "contracts": [
        "ACCESSIBILITY_POLICY.md",
        "registry/accessibility/foundation.json",
        "specs/foundation/accessibility.md"
      ]
    },
    {
      "id": "react-state-foundation",
      "script": "scripts/validate-react-state-foundation.mjs",
      "packageScript": "validate:react-state-foundation",
      "ownerRoles": ["maintainer", "domain-owner", "evidence-reviewer"],
      "contracts": [
        "API_GOVERNANCE.md",
        "NEXTJS_COMPATIBILITY.md",
        "registry/react-state/foundation.json",
        "specs/foundation/react-state.md"
      ]
    },
    {
      "id": "collection-engine",
      "script": "scripts/validate-collection-engine.mjs",
      "packageScript": "validate:collection-engine",
      "ownerRoles": ["maintainer", "domain-owner", "evidence-reviewer"],
      "contracts": [
        "registry/collections/foundation.json",
        "specs/foundation/collection-engine.md",
        "packages/collections/src/index.ts"
      ]
    },
    {
      "id": "overlay-foundation",
      "script": "scripts/validate-overlay-foundation.mjs",
      "packageScript": "validate:overlay-foundation",
      "ownerRoles": ["maintainer", "domain-owner", "evidence-reviewer", "security-reviewer"],
      "contracts": [
        "registry/overlay/foundation.json",
        "specs/foundation/overlay.md",
        "packages/overlay/src/index.ts"
      ]
    },
    {
      "id": "animation-foundation",
      "script": "scripts/validate-animation-foundation.mjs",
      "packageScript": "validate:animation-foundation",
      "ownerRoles": ["maintainer", "domain-owner", "evidence-reviewer"],
      "contracts": [
        "registry/animation/foundation.json",
        "specs/foundation/animation.md",
        "packages/animation/src/index.ts"
      ]
    },
    {
      "id": "data-engine",
      "script": "scripts/validate-data-engine.mjs",
      "packageScript": "validate:data-engine",
      "ownerRoles": ["maintainer", "domain-owner", "evidence-reviewer", "security-reviewer"],
      "contracts": [
        "DATA_ARCHITECTURE.md",
        "registry/data/foundation.json",
        "specs/foundation/data-engine.md",
        "packages/data/src/index.ts"
      ]
    },
    {
      "id": "internationalization",
      "script": "scripts/validate-internationalization.mjs",
      "packageScript": "validate:internationalization",
      "ownerRoles": ["maintainer", "domain-owner", "evidence-reviewer", "security-reviewer"],
      "contracts": [
        "registry/i18n/foundation.json",
        "specs/foundation/internationalization.md",
        "packages/i18n/src/index.ts"
      ]
    },
    {
      "id": "date-math",
      "script": "scripts/validate-date-math.mjs",
      "packageScript": "validate:date-math",
      "ownerRoles": ["maintainer", "domain-owner", "evidence-reviewer", "security-reviewer"],
      "contracts": [
        "registry/date-math/foundation.json",
        "specs/foundation/date-math.md",
        "packages/date-math/src/index.ts"
      ]
    },
    {
      "id": "virtualization-foundation",
      "script": "scripts/validate-virtualization-foundation.mjs",
      "packageScript": "validate:virtualization-foundation",
      "ownerRoles": ["maintainer", "domain-owner", "evidence-reviewer", "security-reviewer"],
      "contracts": [
        "registry/virtualization/foundation.json",
        "specs/foundation/virtualization.md",
        "packages/virtualization/src/index.ts"
      ]
    },
    {
      "id": "drag-drop-foundation",
      "script": "scripts/validate-drag-drop-foundation.mjs",
      "packageScript": "validate:drag-drop-foundation",
      "ownerRoles": ["maintainer", "domain-owner", "evidence-reviewer", "security-reviewer"],
      "contracts": [
        "registry/drag-drop/foundation.json",
        "specs/foundation/drag-drop.md",
        "packages/drag-drop/src/index.ts"
      ]
    },
    {
      "id": "local-reference-config",
      "script": "scripts/validate-local-reference-config.mjs",
      "packageScript": "validate:local-reference-config",
      "ownerRoles": ["maintainer", "evidence-reviewer"],
      "contracts": ["KENDO_REFERENCE_POLICY.md", "reference/local-reference.json"]
    },
    {
      "id": "reference-baseline",
      "script": "scripts/validate-reference-baseline.mjs",
      "packageScript": "validate:reference-baseline",
      "ownerRoles": ["maintainer", "evidence-reviewer", "security-reviewer"],
      "contracts": [
        "KENDO_REFERENCE_POLICY.md",
        "reference/kendo-react-baseline.json",
        "reference/kendo-react-inventory.json",
        "reference/reference-map.json",
        "specs/foundation/reference-baseline.md"
      ]
    },
    {
      "id": "branding",
      "script": "scripts/validate-branding.mjs",
      "packageScript": "validate:branding",
      "ownerRoles": ["maintainer", "domain-owner"],
      "contracts": ["BRANDING.md", "NAMING_CONVENTIONS.md"]
    },
    {
      "id": "documentation-experience",
      "script": "scripts/validate-documentation-experience.mjs",
      "packageScript": "validate:documentation-experience",
      "ownerRoles": ["maintainer", "domain-owner", "evidence-reviewer", "security-reviewer"],
      "contracts": [
        "DOCUMENTATION_POLICY.md",
        ".agent/decisions/ADR-020-documentation-experience-foundation.md",
        "registry/documentation/foundation.json",
        "specs/foundation/documentation-experience.md"
      ]
    },
    {
      "id": "registry",
      "script": "scripts/validate-registry.mjs",
      "packageScript": "validate:registry",
      "ownerRoles": ["maintainer", "domain-owner"],
      "contracts": ["COMPONENT_REGISTRY.md", "registry/schemas/component.schema.json"]
    },
    {
      "id": "stages",
      "script": "scripts/validate-stages.mjs",
      "packageScript": "validate:stages",
      "ownerRoles": ["maintainer", "evidence-reviewer"],
      "contracts": [".agent/stages/index.json", ".agent/component-order.md"]
    },
    {
      "id": "reference-provenance",
      "script": "scripts/validate-reference-provenance.mjs",
      "packageScript": "validate:reference",
      "ownerRoles": ["maintainer", "evidence-reviewer"],
      "contracts": ["KENDO_REFERENCE_POLICY.md", "reference/kendo-react-baseline.json"]
    },
    {